[
  {
    "source_key": "main:alice-madness-returns",
    "game_id": "alice-madness-returns",
    "title": "Alice: Madness Returns",
    "section": "main",
    "profile_source": "alicemadnessreturns",
    "note": "Check the mod's thread or the nexus page for Notes."
  },
  {
    "source_key": "main:assassin-s-creed-iv-black-flagtm",
    "game_id": "assassins-creed-iv-black-flag",
    "title": "Assassin’s Creed® IV Black Flag™",
    "section": "main",
    "profile_source": "asscreedblackflag",
    "note": "Playable, but some unresolved graphical bugs."
  },
  {
    "source_key": "main:atelier-yumia-the-alchemist-of-memories-the-envisioned-land",
    "game_id": "atelier-yumia-the-alchemist-of-memories-the-envisioned-land",
    "title": "Atelier Yumia: The Alchemist of Memories & the Envisioned Land",
    "section": "main",
    "profile_source": "yumia1",
    "note": "Fully playable, just needs playtesting/feedback"
  },
  {
    "source_key": "main:atlas-fallen-dx12",
    "game_id": "atlas-fallen",
    "title": "Atlas Fallen (DX12)",
    "section": "main",
    "profile_source": "atlasfallen",
    "note": "Install ReShade in 'Atlas Fallenbin'. FSR2 causes crashes."
  },
  {
    "source_key": "main:borderlands-2-the-pre-sequel",
    "game_id": "borderlands-2-the-pre-sequel",
    "title": "Borderlands 2 & The Pre-Sequel",
    "section": "main",
    "profile_source": "borderlands2",
    "note": "Check the mod's thread or the nexus page for Notes."
  },
  {
    "source_key": "main:child-of-light",
    "game_id": "child-of-light",
    "title": "Child of Light",
    "section": "main",
    "profile_source": "childoflight",
    "note": "Check the mod's thread or the nexus page for Notes."
  },
  {
    "source_key": "main:clive-barker-s-jericho",
    "game_id": "clive-barker-s-jericho",
    "title": "Clive Barker's Jericho",
    "section": "main",
    "profile_source": "clivebarkersjericho",
    "note": "ACES output is broken, need to be removed in next update"
  },
  {
    "source_key": "main:crimson-desert",
    "game_id": "crimson-desert",
    "title": "Crimson Desert",
    "section": "main",
    "profile_source": "game",
    "note": "Game gets updated regularly breaking the mod. Accurate status info in discord."
  },
  {
    "source_key": "main:days-gone",
    "game_id": "days-gone",
    "title": "Days Gone",
    "section": "main",
    "profile_source": "daysgone",
    "note": "Functional, better than native, but could use some improvement."
  },
  {
    "source_key": "main:dead-island-riptide-definitive-edition",
    "game_id": "dead-island-definitive-edition",
    "title": "Dead Island (& Riptide) Definitive Edition",
    "section": "main",
    "profile_source": "deadislandde",
    "note": "Currently broken"
  },
  {
    "source_key": "main:dragon-s-dogma-2",
    "game_id": "dragon-s-dogma-2",
    "title": "Dragon's Dogma 2",
    "section": "main",
    "profile_source": "dragonsdogma2",
    "note": "Delete shader.cache2 from the game directory when installing this mod, otherwise you'll get shader stutter."
  },
  {
    "source_key": "main:forza-horizon-6",
    "game_id": "forza-horizon-6",
    "title": "Forza Horizon 6",
    "section": "main",
    "profile_source": "forzahorizon6",
    "note": "Arguably not an HDR fix. Vanilla HDR is competent and received a separate grade from SDR."
  },
  {
    "source_key": "main:journey",
    "game_id": "journey",
    "title": "Journey",
    "section": "main",
    "profile_source": "journey",
    "note": "Check the mod's thread or the nexus page for Notes."
  },
  {
    "source_key": "main:ninja-gaiden-4",
    "game_id": "ninja-gaiden-4",
    "title": "Ninja Gaiden 4",
    "section": "main",
    "profile_source": "ninjagaiden4",
    "note": "Requires Lyall's NinjaGaidenMCFix."
  },
  {
    "source_key": "main:ninja-gaiden-sigma",
    "game_id": "ninja-gaiden-sigma",
    "title": "Ninja Gaiden Sigma",
    "section": "main",
    "profile_source": "ngsigma",
    "note": "Requires Lyall's NinjaGaidenMCFix."
  },
  {
    "source_key": "main:ninja-gaiden-sigma-2",
    "game_id": "ninja-gaiden-sigma-2",
    "title": "Ninja Gaiden Sigma 2",
    "section": "main",
    "profile_source": "ngsigma2",
    "note": "Requires Lyall's NinjaGaidenMCFix."
  },
  {
    "source_key": "main:opus-echo-of-starsong-full-bloom-edition",
    "game_id": "opus-echo-of-starsong-full-bloom-edition",
    "title": "OPUS: Echo of Starsong - Full Bloom Edition",
    "section": "main",
    "profile_source": "opus-eos",
    "note": "Steam overlay must be disabled. Disable any other overlays if you run into issues."
  },
  {
    "source_key": "main:remember-me",
    "game_id": "remember-me",
    "title": "Remember Me",
    "section": "main",
    "profile_source": "rememberme",
    "note": "Check the mod's thread or the nexus page for Notes."
  },
  {
    "source_key": "main:raidou-remastered-the-mystery-of-the-soulless-army",
    "game_id": "raidou-remastered-the-mystery-of-the-soulless-army",
    "title": "RAIDOU Remastered: The Mystery of the Soulless Army",
    "section": "main",
    "profile_source": "raidou",
    "note": "Needs playtesting, might be missing shaders for later zones"
  },
  {
    "source_key": "main:sonic-unleashed-recompiled",
    "game_id": "sonic-unleashed-recompiled",
    "title": "Sonic Unleashed Recompiled",
    "section": "main",
    "profile_source": "sonicunleashedrecomp",
    "note": "Motion blur needs to be disabled. Currently doesn't work with RTX 50 GPUs."
  },
  {
    "source_key": "main:spec-ops-the-line",
    "game_id": "spec-ops-the-line",
    "title": "Spec Ops: The Line",
    "section": "main",
    "profile_source": "specopstheline",
    "note": "Check the mod's thread or the nexus page for Notes."
  },
  {
    "source_key": "main:s-t-a-l-k-e-r-2-heart-of-chornobyl",
    "game_id": "s-t-a-l-k-e-r-2-heart-of-chornobyl",
    "title": "S.T.A.L.K.E.R. 2: Heart of Chornobyl",
    "section": "main",
    "profile_source": "ue-extended",
    "note": "UE-Extended mod. Set gamma/contrast/brightness ingame settings to 50%!"
  },
  {
    "source_key": "main:steelrising",
    "game_id": "steelrising",
    "title": "Steelrising",
    "section": "main",
    "profile_source": "steelrising",
    "note": "Currently broken"
  },
  {
    "source_key": "main:the-evil-within-2",
    "game_id": "the-evil-within-2",
    "title": "The Evil Within 2",
    "section": "main",
    "profile_source": "tew2",
    "note": "Fully playable, just needs playtesting/feedback"
  },
  {
    "source_key": "main:tomb-raider-2013-definitive-edition",
    "game_id": "tomb-raider-2013-definitive-edition",
    "title": "Tomb Raider (2013) - Definitive Edition",
    "section": "main",
    "profile_source": "tombraider2013de",
    "note": "Breaks the lighting in some parts of the game, like the Chasm Monastery"
  },
  {
    "source_key": "main:trackmania",
    "game_id": "trackmania",
    "title": "Trackmania",
    "section": "main",
    "profile_source": "trackmania",
    "note": "Mod has great HDR, but breaks some customization menus."
  },
  {
    "source_key": "main:yakuza-kiwami-1",
    "game_id": "yakuza-kiwami-1",
    "title": "Yakuza Kiwami 1",
    "section": "main",
    "profile_source": "yakuza0",
    "note": "Mod primarily made for Y0."
  },
  {
    "source_key": "ue-extended:abiotic-factor",
    "game_id": "abiotic-factor",
    "title": "Abiotic Factor",
    "section": "ue-extended",
    "profile_source": "ue-extended",
    "note": "Engine.ini"
  },
  {
    "source_key": "ue-extended:abzu",
    "game_id": "abzu",
    "title": "ABZÛ",
    "section": "ue-extended",
    "profile_source": "ue-extended",
    "note": "Upgrade Path: On `B8G8R8A8_TYPELESS` `Output Size` for 100% render resolution or `Output Ratio` for other percentages."
  },
  {
    "source_key": "ue-extended:assetto-corsa-rally",
    "game_id": "assetto-corsa-rally",
    "title": "Assetto Corsa Rally",
    "section": "ue-extended",
    "profile_source": "ue-extended",
    "note": "Native HDR"
  },
  {
    "source_key": "ue-extended:astroneer",
    "game_id": "astroneer",
    "title": "Astroneer",
    "section": "ue-extended",
    "profile_source": "ue-extended",
    "note": "Upgrade Path: On. Grading and flickering issues."
  },
  {
    "source_key": "ue-extended:a-way-out",
    "game_id": "a-way-out",
    "title": "A Way Out",
    "section": "ue-extended",
    "profile_source": "ue-extended",
    "note": "Upgrade Path: On. Lacks testing."
  },
  {
    "source_key": "ue-extended:black-myth-wukong",
    "game_id": "black-myth-wukong",
    "title": "Black Myth: Wukong",
    "section": "ue-extended",
    "profile_source": "ue-extended",
    "note": "Engine.ini, Only add `r.HDR.EnableHDROutput=1` to Engine.ini."
  },
  {
    "source_key": "ue-extended:borderlands-4",
    "game_id": "borderlands-4",
    "title": "Borderlands 4",
    "section": "ue-extended",
    "profile_source": "ue-extended",
    "note": "Native HDR"
  },
  {
    "source_key": "ue-extended:bodycam",
    "game_id": "bodycam",
    "title": "Bodycam",
    "section": "ue-extended",
    "profile_source": "ue-extended",
    "note": "Engine.ini"
  },
  {
    "source_key": "ue-extended:chained-together",
    "game_id": "chained-together",
    "title": "Chained Together",
    "section": "ue-extended",
    "profile_source": "ue-extended",
    "note": "Engine.ini, Slider do not change in real-time."
  },
  {
    "source_key": "ue-extended:choo-choo-charles",
    "game_id": "choo-choo-charles",
    "title": "Choo-Choo Charles",
    "section": "ue-extended",
    "profile_source": "ue-extended",
    "note": "Engine.ini"
  },
  {
    "source_key": "ue-extended:chromatic-conundrum",
    "game_id": "chromatic-conundrum",
    "title": "Chromatic Conundrum",
    "section": "ue-extended",
    "profile_source": "ue-extended",
    "note": "Upgrade Path: Off. Broken rendering when enabled."
  },
  {
    "source_key": "ue-extended:conan-exiles-enhanced",
    "game_id": "conan-exiles-enhanced",